{
  "$schema": "../../Schemas/release-qualification-v1.schema.json",
  "engineering": {
    "bindings": [
      {
        "path": "scripts/check-active-source-manifest.py",
        "purpose": "active-source-checker",
        "sha256": "fd0713bf9f077a2eda44fee5bb343ce1bce9aa612f24928fafcb5ae031bcdd18"
      },
      {
        "path": "scripts/package-browser-extension.sh",
        "purpose": "browser-extension-package-script",
        "sha256": "21627c214bd7014aec993abdc4fb7c0ed83ccabc198f8f1f18446b08459753de"
      },
      {
        "path": "scripts/test-browser-component-swap.sh",
        "purpose": "browser-component-swap-test",
        "sha256": "58fdf3d26c05d548e041d1c05aac617f498ea114b97d66b33d1a6d39c27e6a63"
      },
      {
        "path": "scripts/release-chromium-browser.sh",
        "purpose": "browser-release-script",
        "sha256": "63f9ff6b8d48a0a8ae90dccd8d2239e630278b98d304d75015e89649484b7def"
      },
      {
        "path": ".github/workflows/ci.yml",
        "purpose": "ci-workflow",
        "sha256": "0b3296a801839c1a3e717ea54e9b3480a5683aa2250802f8f80ab8fd4b0e7153"
      },
      {
        "path": "scripts/check-core-blackbox-parity.py",
        "purpose": "core-parity-checker",
        "sha256": "3a45bd5fec2e385d2f193969f9da67590e9df1c09c465770de3813cda97cbaa9"
      },
      {
        "path": "scripts/check-independent-api.sh",
        "purpose": "independent-api-checker",
        "sha256": "86f9704d421ce467ffe2e65691e86c53816dc48df0260836f9da0d5da27d3d3f"
      },
      {
        "path": "scripts/package-resource-policy.sh",
        "purpose": "package-resource-policy",
        "sha256": "196817c28ea8eff2f12c3ad2fb7347022e3ee4f84b6883f4861d087f1aa7e5c8"
      },
      {
        "path": "package.sh",
        "purpose": "package-script",
        "sha256": "7756186287070e7ab9d51c5369be2d8d23ee1b5b18a84211bfd1c29f02877a48"
      },
      {
        "path": "Tests/perf-gate.sh",
        "purpose": "performance-gate",
        "sha256": "50aba296b02bfe9470673249d4ed1d3c62f95345ae75809d0b2784993afe1262"
      },
      {
        "path": "Identity/Sources/ProductIdentity/Resources/product-identity.json",
        "purpose": "product-identity",
        "sha256": "b98bf649bee7043f151d5f575a82d79d6959b8f90a5566460815ab5cf8e25e33"
      },
      {
        "path": "scripts/product-identity.sh",
        "purpose": "product-identity-script",
        "sha256": "3f72a56a701089775128e64404e3b37154855d48006a9edc607eb80492fef928"
      },
      {
        "path": "docs/independence/WORKING_TREE_PROVENANCE_ALLOWLIST.json",
        "purpose": "provenance-allowlist",
        "sha256": "60f410377c96c70f96c86edd4a70126122dd51c6e15e2d9ea6670c8ccc867668"
      },
      {
        "path": "scripts/check-working-tree-provenance.py",
        "purpose": "provenance-checker",
        "sha256": "590d7d586bc51b5e144472eadbda1d0b6e6dbb58c432283469e3f8fff67f5838"
      },
      {
        "path": "scripts/check-release-qualification.py",
        "purpose": "qualification-checker",
        "sha256": "66512f2d202d1397f876657bad186bdb3ba25c363a551e93145bb48be87537d9"
      },
      {
        "path": "Schemas/release-qualification-v1.schema.json",
        "purpose": "qualification-schema",
        "sha256": "ec5d10ef02298bdad207341fa1c26e50a9e70ec01628a77421fa4fc3b9caba1f"
      },
      {
        "path": "Tests/RendererPixelOracle/ReferenceCorpus/reference-corpus-v1.tar.gz",
        "purpose": "renderer-corpus-archive",
        "sha256": "5507d54ebe8e453edc9f38d3dbf84ac01ef132ae8370a3a7de39a1624d46188a"
      },
      {
        "path": "Tests/RendererPixelOracle/ReferenceCorpus/reference-corpus-v1.lock.json",
        "purpose": "renderer-corpus-lock",
        "sha256": "a448c37b7e114505f4e8569ed9389c608698cb9bf50b7c0219daff4fd10ccd2f"
      },
      {
        "path": "Tests/RendererPixelOracle/ReferenceCorpus/reference-corpus-v1.validator-vector.json",
        "purpose": "renderer-corpus-validator-vector",
        "sha256": "9c987783edd7ede5cba9d2f4ea455667cd47ad55c620ebee26d27b70b6cc76fb"
      },
      {
        "path": "Tests/RendererPixelOracle/RendererPixelFixture.swift",
        "purpose": "renderer-fixture",
        "sha256": "aad4c214230f0106246bb54c58479dfa492cfc3f03093934511ab6d84a81cc8f"
      },
      {
        "path": "scripts/check-renderer-pixel-parity.py",
        "purpose": "renderer-parity-checker",
        "sha256": "d1778c09ffac63edf8fe20934c9633fc09538a90d6d72da11a7e9914d596f0bb"
      },
      {
        "path": "release.sh",
        "purpose": "release-script",
        "sha256": "8a8107af1e9d02f46ceb59c47b6b1a0e842a6281e7e79206bb921d2b80a2fb15"
      },
      {
        "path": ".github/workflows/release.yml",
        "purpose": "release-workflow",
        "sha256": "5af5b1ea85e825b09533131334bdbd95d24a6d6ec986723ca2a3b5f5965b5dd1"
      },
      {
        "path": "test.sh",
        "purpose": "resource-stress-gate",
        "sha256": "fac26205a44b8843a1271fc368a604a947c35d1fe76ff1c2e7ade95ba632781a"
      },
      {
        "path": "Tests/zoo.sh",
        "purpose": "tui-zoo-gate",
        "sha256": "4a9f9d67c46556f38eeb0df5689315b89da35a957b1bab0adaf574301bf75d2b"
      },
      {
        "path": "scripts/check-zoo-review.py",
        "purpose": "zoo-review-checker",
        "sha256": "99953d153673c705c8a173d55ea2fd9bb8bea41ac979e4933d326ffdc1202cc6"
      }
    ],
    "coreMatrix": {
      "actionsPerCase": 180,
      "casesPerSeed": 3176,
      "randomCasesPerSeed": 2000,
      "seeds": [
        49361,
        104729,
        123457,
        99991,
        2654435761,
        130363,
        155921,
        271828,
        314159,
        161803,
        65537,
        16777619,
        20260820,
        8675309,
        42424243,
        314159265,
        271828182
      ],
      "totalCases": 53992
    },
    "rendererCorpus": {
      "archiveSha256": "5507d54ebe8e453edc9f38d3dbf84ac01ef132ae8370a3a7de39a1624d46188a",
      "candidateFixtureSha256": "aad4c214230f0106246bb54c58479dfa492cfc3f03093934511ab6d84a81cc8f",
      "fixtureCount": 40,
      "fixtureIndexSha256": "e52c987c52e495dc7bb7a14ccf8d9ef6b0abd4e8fed6d60facd469a2af6f9d5d",
      "lockSha256": "a448c37b7e114505f4e8569ed9389c608698cb9bf50b7c0219daff4fd10ccd2f",
      "referenceManifestSha256": "868ffcb241e050c570278e5d6aa7fef2adfb6b15b938bee13e8917b7bd42d7b6",
      "validatorVectorSha256": "9c987783edd7ede5cba9d2f4ea455667cd47ad55c620ebee26d27b70b6cc76fb"
    }
  },
  "kind": "cmdy-release-qualification",
  "publication": {
    "approval": null,
    "evidence": {
      "core": {
        "record": {
          "path": "docs/independence/qualification/core-17-seed.json",
          "sha256": "77a342e81125a795a811b5c1fad5d908e25bdfd2073061c610f78aa70e0da32d"
        },
        "sourceManifestSha256": "42c7cd637a5c8546e755ed7775cb47abd95063468ab55499b4778bcd80a88572"
      },
      "operational": {
        "record": {
          "path": "docs/independence/qualification/operational-review.json",
          "sha256": "702c78163a367a8e5ba4b898e42560c5a4182e44326c3fe9e108428c4bcf2f76"
        },
        "sourceManifestSha256": "42c7cd637a5c8546e755ed7775cb47abd95063468ab55499b4778bcd80a88572"
      },
      "renderer": {
        "checkerSha256": "d1778c09ffac63edf8fe20934c9633fc09538a90d6d72da11a7e9914d596f0bb",
        "comparison": {
          "path": "docs/independence/qualification/renderer-comparison.json",
          "sha256": "8624d3e5534c9edc65756af3432ec00ca5e464b73154c89ad86b2b12048f0668"
        },
        "environment": {
          "path": "docs/independence/qualification/renderer-environment.json",
          "sha256": "0f98f37572faefc3ddc852161cfae177206817027d17e91cb44703202d4e6997"
        },
        "sourceManifestSha256": "42c7cd637a5c8546e755ed7775cb47abd95063468ab55499b4778bcd80a88572"
      }
    },
    "source": {
      "activeSourceManifest": {
        "path": "docs/independence/qualification/active-terminal-sources.json",
        "sha256": "42c7cd637a5c8546e755ed7775cb47abd95063468ab55499b4778bcd80a88572"
      },
      "provenanceReport": {
        "path": "docs/independence/qualification/working-tree-provenance.json",
        "sha256": "f2d8aae1363ed07e80dc2e56979337855f97c680c16cbceb6b307c2cbd4f5644"
      },
      "sourceCommit": "19d66b6338360b23719bd3ff645a77cb1a934be2",
      "sourceTree": "2568d5f3da580689cfb023ef8960fc3c13d10f56"
    },
    "state": "pending"
  },
  "schemaVersion": 1
}
